{
  "schemaVersion": 1,
  "kind": "store-operating-rule-switch-catalog",
  "revision": "STORE_OPERATING_RULES_20260916",
  "valueTypes": ["BOOLEAN", "NUMBER", "STRING"],
  "definitions": [
    {"key": "catalogManagementEnabled", "label": "是否启用商品、库存和菜单管理", "type": "BOOLEAN", "defaultValue": false, "parentKey": null, "displayOrder": 1},
    {"key": "externalCatalogSyncEnabled", "label": "是否启用外部商品、库存、菜单同步", "type": "BOOLEAN", "defaultValue": false, "parentKey": "catalogManagementEnabled", "displayOrder": 2},
    {"key": "openPlatformDeveloperCode", "label": "开放平台开发者编码", "type": "STRING", "defaultValue": "", "parentKey": "externalCatalogSyncEnabled", "displayOrder": 3},
    {"key": "reservationEnabled", "label": "是否启用预约功能", "type": "BOOLEAN", "defaultValue": false, "parentKey": "catalogManagementEnabled", "displayOrder": 4},
    {"key": "reservationDepositEnabled", "label": "是否支持押金预约", "type": "BOOLEAN", "defaultValue": false, "parentKey": "reservationEnabled", "displayOrder": 5},
    {"key": "queueCallEnabled", "label": "是否启用排队叫号", "type": "BOOLEAN", "defaultValue": false, "parentKey": "catalogManagementEnabled", "displayOrder": 6},
    {"key": "tableManagementEnabled", "label": "是否启用桌台管理", "type": "BOOLEAN", "defaultValue": false, "parentKey": "catalogManagementEnabled", "displayOrder": 7},
    {"key": "tableStatusEnabled", "label": "是否启用桌台状态管理", "type": "BOOLEAN", "defaultValue": false, "parentKey": "tableManagementEnabled", "displayOrder": 8},
    {"key": "tableWaitCallEnabled", "label": "是否支持「等叫」功能", "type": "BOOLEAN", "defaultValue": false, "parentKey": "tableStatusEnabled", "displayOrder": 9},
    {"key": "banquetOrderEnabled", "label": "是否支持宴会订单", "type": "BOOLEAN", "defaultValue": false, "parentKey": "tableStatusEnabled", "displayOrder": 10},
    {"key": "pickupCallEnabled", "label": "是否启用取餐叫号", "type": "BOOLEAN", "defaultValue": false, "parentKey": "catalogManagementEnabled", "displayOrder": 11},
    {"key": "receivableEnabled", "label": "是否支持应收单管理", "type": "BOOLEAN", "defaultValue": false, "parentKey": null, "displayOrder": 12}
  ]
}
